{
  "manifest_version": "phase7.2",
  "manifest_type": "ai_learning_generation_execution_plan",
  "phase": "7.2",
  "artifact_type": "ai_learning_generation_execution_plan",
  "status": "ai_learning_generation_execution_plan_created",
  "created_for_phase": "7.2",
  "created_at": "2026-06-04T00:00:00Z",

  "execution_plan_status": "planned",
  "execution_mode": "offline_existing_source_packet_only",
  "execution_status": "not_started",

  "upstream_phase": "7.1",
  "upstream_manifest": "phase7_1_ai_learning_generation_approval_gate.json",
  "upstream_artifact_type": "ai_learning_generation_approval_gate",
  "upstream_approval_status": "ai_learning_generation_approved",
  "upstream_ai_learning_generation_approved": true,

  "batch_id": "phase6_1_batch_001",

  "crawler_allowed": false,
  "renderer_allowed": false,
  "recovery_allowed": false,
  "web_requests_allowed": false,
  "source_layer_modification_allowed": false,
  "ai_learning_content_generation_allowed": true,
  "ai_learning_request_creation_allowed": true,
  "phase7_2_entry_allowed": true,
  "phase7_3_entry_allowed": false,

  "planned_outputs": [
    { "name": "learning_objectives", "status": "planned" },
    { "name": "knowledge_units", "status": "planned" },
    { "name": "exam_oriented_explanations", "status": "planned" },
    { "name": "practice_questions", "status": "planned" },
    { "name": "answer_rationales", "status": "planned" },
    { "name": "misconception_warnings", "status": "planned" },
    { "name": "review_checklist", "status": "planned" },
    { "name": "source_traceability_map", "status": "planned" }
  ],
  "actual_generated_outputs": [],

  "scope": {
    "allowed": [
      "AI learning generation execution plan creation",
      "generation boundary documentation",
      "planned output documentation",
      "generation mode documentation",
      "source basis documentation",
      "Phase 7.1 approval gate reference",
      "next-phase constraint documentation"
    ],
    "forbidden": [
      "AI learning content generation",
      "study notes creation",
      "question bank creation",
      "explanations creation",
      "flashcard creation",
      "diagram creation",
      "summary creation",
      "rendered learning content creation",
      "crawler execution",
      "renderer execution",
      "recovery execution",
      "web requests",
      "source layer mutation",
      "raw snapshot creation",
      "intermediate JSON creation",
      "asset capture"
    ],
    "allowed_source_basis": "closed_pass_phase6_1_batch_001_only",
    "unapproved_sources_allowed": false,
    "external_sources_allowed": false,
    "source_expansion_allowed": false,
    "generation_mode": "offline_existing_source_packet_only",
    "source_packet_boundary": "frozen_after_phase6_22_closure"
  },

  "risk": {
    "risk_level": "low",
    "risk_reason": "Phase 7.2 creates an execution plan as metadata only and does not generate learning content or mutate source-layer artifacts."
  },

  "closure": {
    "phase7_2_status": "complete",
    "phase7_2_result": "pass"
  },

  "next_phase_recommendation": {
    "next_recommended_phase": "phase7.3_ai_learning_generation_validation",
    "phase7_3_entry_allowed": false,
    "phase7_3_entry_requires_approval": true,
    "notes": "Phase 7.3 is not authorized by this plan alone. A separate execution completion artifact must be created before Phase 7.3 entry is permitted."
  },

  "rollback_condition": {
    "phase7_2_rollback_needed": false,
    "reason": "Execution plan recorded as metadata only; no content generation occurred.",
    "future_rollback_requirements": [
      "If the execution plan is found to be incorrect, it must be revised",
      "If the approved generation scope changes, the execution plan must be updated",
      "If the Phase 7.1 approval is revoked, the execution plan must be invalidated"
    ]
  },

  "audit_condition": {
    "upstream_phase": "7.1",
    "upstream_approval_status": "ai_learning_generation_approved",
    "upstream_ai_learning_generation_approved": true,
    "current_execution_plan_status": "planned",
    "current_execution_status": "not_started",
    "current_ai_learning_content_generation_allowed": true,
    "current_phase7_2_entry_allowed": true,
    "current_phase7_3_entry_allowed": false,
    "planned_output_count": 8,
    "actual_generated_outputs_empty": true,
    "source_packet_boundary_frozen": true,
    "validation_commands": [
      "pnpm typecheck",
      "pnpm verify",
      "pnpm validate:ai-learning-generation-approval-gate",
      "pnpm validate:ai-learning-generation-execution-plan"
    ],
    "commit_scope": "Phase 7.2 AI learning generation execution plan files and related schema/type/validator/package verification changes only"
  },

  "phase_progression_history": [
    { "phase": "7.0", "outcome": "ai_learning_generation_request_created" },
    { "phase": "7.1", "outcome": "ai_learning_generation_approval_gate_recorded" },
    { "phase": "7.2", "outcome": "ai_learning_generation_execution_plan_created" }
  ],

  "validation_expectations": {
    "schema_validation": "must_pass",
    "invariant_checks": "must_pass",
    "phase_must_be": "7.2",
    "artifact_type_must_be": "ai_learning_generation_execution_plan",
    "execution_plan_status_must_be": "planned",
    "execution_mode_must_be": "offline_existing_source_packet_only",
    "execution_status_must_be": "not_started",
    "upstream_phase_must_be": "7.1",
    "upstream_approval_status_must_be": "ai_learning_generation_approved",
    "upstream_ai_learning_generation_approved_must_be": true,
    "batch_id_must_be": "phase6_1_batch_001",
    "ai_learning_content_generation_allowed_must_be": true,
    "phase7_2_entry_allowed_must_be": true,
    "phase7_3_entry_allowed_must_be": false,
    "crawler_allowed_must_be": false,
    "renderer_allowed_must_be": false,
    "recovery_allowed_must_be": false,
    "web_requests_allowed_must_be": false,
    "source_layer_modification_allowed_must_be": false,
    "actual_generated_outputs_must_be_empty": true,
    "planned_output_count_must_be": 8,
    "all_planned_outputs_status_must_be_planned": true,
    "risk_level_must_be": "low",
    "closure_status_must_be": "complete",
    "closure_result_must_be": "pass"
  }
}
